{
  "version": "1.0.0",
  "colors": {
    "primary": "#3B82F6",
    "secondary": "#8B5CF6",
    "accent": "#F59E0B",
    "background": "#FFFFFF",
    "surface": "#F8FAFC",
    "text": "#111827",
    "muted": "#6B7280",
    "success": "#16A34A",
    "danger": "#DC2626"
  },
  "spacing": {
    "xs": "4px",
    "sm": "8px",
    "md": "16px",
    "lg": "24px",
    "xl": "32px",
    "2xl": "48px"
  },
  "typography": {
    "fontFamily": {
      "primary": "Inter, system-ui, -apple-system, Segoe UI, Roboto, Ubuntu, Cantarell, Noto Sans, Helvetica Neue, Arial, \"Apple Color Emoji\", \"Segoe UI Emoji\", \"Segoe UI Symbol\""
    },
    "fontSize": {
      "sm": "0.875rem",
      "base": "1rem",
      "lg": "1.125rem",
      "xl": "1.25rem",
      "2xl": "1.5rem"
    },
    "lineHeight": {
      "normal": "1.5"
    },
    "fontWeight": {
      "regular": 400,
      "semibold": 600,
      "bold": 700
    }
  },
  "breakpoints": {
    "sm": "640px",
    "md": "768px",
    "lg": "1024px",
    "xl": "1280px"
  }
}
